{"$schema":"https://json-schema.org/draft/2020-12/schema","$id":"https://babb.dev/schemas/vnext-css-module-isomorphism-1.json","type":"object","additionalProperties":false,"required":["schema","source","authority","modules","edge_corrections","excluded","manifest_hash"],"properties":{"schema":{"const":"vnext-css-module-isomorphism/1"},"source":{"type":"object","additionalProperties":false,"required":["repository","commit","root"],"properties":{"repository":{"const":"/Users/mkbabb/Programming/bbnf-lang"},"commit":{"type":"string","pattern":"^[0-9a-f]{40}$"},"root":{"const":"grammar/css"}}},"authority":{"type":"object","additionalProperties":false,"required":["snapshot_kind","execution_resnapshot","translation","module_join","responsibility_join","import_join","runtime_modules_sha256","excluded_dispositions_sha256","resolved_edges_sha256","runtime","future_generated_parser","imports_active_engine_novelty"],"properties":{"snapshot_kind":{"enum":["formation-current","execution-input"]},"execution_resnapshot":{"const":"after the active BBNF CSS full-modular-union freeze, partition every committed grammar/css/**/*.bbnf file at the P00/P01 coordination pin into runtime modules or typed non-runtime exclusions"},"translation":{"const":"handwritten-parse-that-combinators"},"module_join":{"const":"replace grammar/css/ with src/css/grammar/ and .bbnf with .ts"},"responsibility_join":{"const":"every runtime BBNF CSS module has exactly one typed TypeScript combinator peer and external test owning the same grammar responsibility; every other CSS grammar has one typed non-runtime disposition"},"import_join":{"const":"formation snapshots may record exact upstream defects; an execution-input snapshot requires zero corrections and TypeScript edges equal BBNF edges exactly"},"runtime_modules_sha256":{"type":"string","pattern":"^[0-9a-f]{64}$"},"excluded_dispositions_sha256":{"type":"string","pattern":"^[0-9a-f]{64}$"},"resolved_edges_sha256":{"type":"string","pattern":"^[0-9a-f]{64}$"},"runtime":{"const":"typescript-combinator-only"},"future_generated_parser":{"const":"replacement-only-after-separate-adjudication"},"imports_active_engine_novelty":{"const":false}}},"modules":{"type":"array","minItems":1,"items":{"type":"object","additionalProperties":false,"required":["bbnf_path","bbnf_sha256","typescript_path","test_path","imports"],"properties":{"bbnf_path":{"type":"string","pattern":"^grammar/css/(?:[a-z0-9][a-z0-9-]*/)*[a-z0-9][a-z0-9-]*\\.bbnf$"},"bbnf_sha256":{"type":"string","pattern":"^[0-9a-f]{64}$"},"typescript_path":{"type":"string","pattern":"^src/css/grammar/(?:[a-z0-9][a-z0-9-]*/)*[a-z0-9][a-z0-9-]*\\.ts$"},"test_path":{"type":"string","pattern":"^test/src/css/grammar/(?:[a-z0-9][a-z0-9-]*/)*[a-z0-9][a-z0-9-]*\\.test\\.ts$"},"imports":{"type":"array","uniqueItems":true,"items":{"type":"string","pattern":"^grammar/css/(?:[a-z0-9][a-z0-9-]*/)*[a-z0-9][a-z0-9-]*\\.bbnf$"}}}}},"edge_corrections":{"type":"array","uniqueItems":true,"items":{"type":"object","additionalProperties":false,"required":["from","to","owner","reason"],"properties":{"from":{"type":"string","pattern":"^grammar/css/(?:[a-z0-9][a-z0-9-]*/)*[a-z0-9][a-z0-9-]*\\.bbnf$"},"to":{"type":"string","pattern":"^grammar/css/(?:[a-z0-9][a-z0-9-]*/)*[a-z0-9][a-z0-9-]*\\.bbnf$"},"owner":{"type":"string","minLength":1},"reason":{"type":"string","minLength":1}}}},"excluded":{"type":"array","uniqueItems":true,"items":{"type":"object","additionalProperties":false,"required":["bbnf_path","bbnf_sha256","disposition","reason"],"properties":{"bbnf_path":{"type":"string","pattern":"^grammar/css/(?:[a-z0-9][a-z0-9-]*/)*[a-z0-9][a-z0-9-]*\\.bbnf$"},"bbnf_sha256":{"type":"string","pattern":"^[0-9a-f]{64}$"},"disposition":{"const":"serialization-test-oracle-only"},"reason":{"type":"string","minLength":1}}}},"shared_typed_data_imports":{"type":"array","maxItems":4,"uniqueItems":true,"items":{"type":"object","additionalProperties":false,"required":["from","specifier","target","sha256","kind"],"properties":{"from":{"type":"string","pattern":"^src/css/grammar/(?:[a-z0-9][a-z0-9-]*/)*[a-z0-9][a-z0-9-]*\\.ts$"},"specifier":{"type":"string","pattern":"^(?:\\.\\.?/)+(?:[a-z0-9][a-z0-9-]*/)*[a-z0-9][a-z0-9-]*(?:\\.(?:js|ts))?$"},"target":{"type":"string","pattern":"^(?:[a-z0-9][a-z0-9-]*/)+[a-z0-9][a-z0-9-]*\\.ts$"},"sha256":{"type":"string","pattern":"^[0-9a-f]{64}$"},"kind":{"const":"shared-typed-data"}}}},"manifest_hash":{"type":"string","pattern":"^[0-9a-f]{64}$"}}}
